{
    "schema_version":  "v1",
    "package_id":  "pkg_field_ops_001",
    "tenant_id":  "tenant_demo",
    "app_id":  "field_ops_app",
    "app_version":  "0.1.0",
    "runtime_min_version":  "0.1.0",
    "runtime_max_version":  "0.1.0",
    "platform_version":  "0.1.0",
    "channel":  "dev",
    "modules":  [
                    {
                        "schema_version":  "v1",
                        "module_id":  "core",
                        "name":  "Core",
                        "description":  "Core platform module for shared primitives.",
                        "version":  "0.1.0",
                        "platform_min_version":  "0.1.0",
                        "runtime_min_version":  "0.1.0",
                        "runtime_max_version":  "0.1.0",
                        "plugin_api_version":  0,
                        "dependencies":  [

                                         ],
                        "surfaces":  {
                                         "backend":  {
                                                         "django_app":  "apps.core",
                                                         "api_schema":  "apps.core.schema",
                                                         "jobs":  [
                                                                      "health_check"
                                                                  ],
                                                         "events":  [
                                                                        "core.started"
                                                                    ]
                                                     },
                                         "frontend_admin":  {
                                                                "routes":  [
                                                                               {
                                                                                   "path":  "/dashboard",
                                                                                   "component":  "DashboardPage",
                                                                                   "permission":  "core.view_dashboard"
                                                                               }
                                                                           ],
                                                                "menus":  [
                                                                              {
                                                                                  "label":  "Dashboard",
                                                                                  "route":  "/dashboard",
                                                                                  "permission":  "core.view_dashboard"
                                                                              }
                                                                          ],
                                                                "translations":  [
                                                                                     "en"
                                                                                 ]
                                                            },
                                         "mobile":  {
                                                        "widgets":  [
                                                                        "text",
                                                                        "button"
                                                                    ],
                                                        "actions":  [
                                                                        "navigate"
                                                                    ],
                                                        "sync_handlers":  [
                                                                              "default_outbox"
                                                                          ]
                                                    }
                                     },
                        "configuration_schemas":  [
                                                      {
                                                          "name":  "core_settings",
                                                          "schema_id":  "https://schemas.mobile-framework.local/v1/core-settings.schema.json"
                                                      }
                                                  ],
                        "permissions":  [
                                            {
                                                "code":  "core.view_dashboard",
                                                "label":  "View dashboard"
                                            }
                                        ],
                        "extensions":  {
                                           "notes":  "Example extension payload."
                                       }
                    }
                ],
    "theme":  {
                  "schema_version":  "v1",
                  "theme_id":  "field_ops",
                  "name":  "Field Operations",
                  "description":  "Accessible starter theme for mobile field work.",
                  "version":  "0.1.0",
                  "tokens":  {
                                 "colors":  {
                                                "primary":  {
                                                                "light":  "#6EA8FF",
                                                                "main":  "#0B5FFF",
                                                                "dark":  "#003EA8",
                                                                "contrast":  "#FFFFFF"
                                                            },
                                                "secondary":  {
                                                                  "light":  "#9BE7C2",
                                                                  "main":  "#168A55",
                                                                  "dark":  "#0B5C38",
                                                                  "contrast":  "#FFFFFF"
                                                              },
                                                "background":  "#F6F8FB",
                                                "surface":  "#FFFFFF",
                                                "text":  "#172033",
                                                "success":  "#168A55",
                                                "warning":  "#B26A00",
                                                "danger":  "#B42318"
                                            },
                                 "typography":  {
                                                    "font_family":  "Atkinson Hyperlegible",
                                                    "fallback_family":  "sans-serif",
                                                    "scale":  {
                                                                  "body":  {
                                                                               "font_size":  16,
                                                                               "line_height":  24,
                                                                               "font_weight":  400
                                                                           },
                                                                  "heading":  {
                                                                                  "font_size":  24,
                                                                                  "line_height":  32,
                                                                                  "font_weight":  700,
                                                                                  "letter_spacing":  -0.2
                                                                              }
                                                              }
                                                },
                                 "spacing":  {
                                                 "xs":  4,
                                                 "sm":  8,
                                                 "md":  16,
                                                 "lg":  24,
                                                 "xl":  32
                                             },
                                 "radius":  {
                                                "sm":  4,
                                                "md":  10,
                                                "lg":  18
                                            },
                                 "elevation":  {
                                                   "none":  {
                                                                "level":  0
                                                            },
                                                   "card":  {
                                                                "level":  2,
                                                                "shadow":  "0 8px 24px rgba(23, 32, 51, 0.12)"
                                                            }
                                               },
                                 "components":  {
                                                    "button_primary":  {
                                                                           "background":  "#0B5FFF",